Are you a pair of glasses? You don’t appear to be one of my contacts.,1
Want to play agent and fondle my package?,1
God has used you to teach me what true love really is,0
"My body is a temple, so make sure you take your shoes off before you come in.",1
You must be Egyptian because I'm a slave for you.,1
My vocations director said i should talk to you . . . .,1
"I used to believe in natural theology, but since I met you I've converted to divine revelation.",0
"Girl, you like toasters? Let's get in bread together.",0
Got a toaster? Because your beautify is shocking me.,0
Girl. You condition my guns.,0
"Sleep with a UPS driver, because they always deliver.",1
Are you a boat? Because you need some captain to enter your pit.,0
Am I dreaming... or are you a revelation?,0
I wanna boldly go into your bed to cuddle because I think you're cute and don't want to rush things.,0
"When I saw you, I knew the true meaning of “Rejoice and Be Glad.”",0
Wanna serve at the soup kitchen with me on Wednesday?,0
It’s dark in here. Wait! It’s because all my light is shining on you.,0
Is your name Faith? Because you're the substance of things I've hoped for.,0
Do you trampoline? Because I want to break a bone into you.,0
Do you usually take out the trash? Then it shouldn't be so hard to take me out.,0
Are you microwaveable? Because I got some hot pockets.,0
"Wow, God must have been having a good day when He created you.",0
You a microwave? Because you warm my meat inside.,1
"If I’d give you eleven roses, what would you see in the mirror? A dozen roses.",1
"Are you a camera? Because every time I look at you, I smile.",1
Want to go back to my place and watch p*rn on my flat screen mirror?,0
If you were two letters of the alphabet You would be a Q T.,1
Want to spin a dreidel with me?,0
Are you an auto loan? Because you help moving my life forward.,1
"I know you're an atheist, but I can make you scream God.",1
I heard you like teddy bears. You can give me a cuddle.,0
"“Take me to bed or lose me forever.” — Carole, Top Gun",0
Hey so you want to see some magic? You and I will go to your place and I’ll disappear in the morning.,0
"Do you have a camera? No? That's okay, I can still picture us together.",1
Are you a deity? Because you look unreal.,0
I know I'm trash. But will you be my trash bin?,0
Are you a deity? Because you look out of this world.,0
"Girl, are you my glasses? Cause I want you on my face 24/7.",1
My friend over there really wants your number so they know where to get a hold of me in the morning.,0
I would totally carve your pumpkin sweetheart.,0
Hey girl. I heard Jesus called you. Mind I do the same?,0
"Girl let me tie your shoes, because I can go down on you any time.",1
It makes my head spin to see you serve food to those homeless people. You're such a servant.,0
Does your Dad wear a baker's hat? Because you've got a nice set of buns.,0
Are you lost? Because I can give you the keys to my place.,0
You don’t need keys to drive me crazy.,1
Did it hurt when they manufactured you in heaven?,0
Is your name virtue? Because you garnish MY thoughts unceasingly!,0
"Girl, are you pajamas? Because I want to fall asleep with you every night.",1
Do you believe in Divine Appointment?,0
"No relationship is all sunshine, but we can share one umbrella and survive the storm together.",0
Are those kolob pants you're wearing? Because your ass is out of this world!,1
I sometimes write for Called to Communion. Coffee?,1
"I am not a prickly eater, I'll eat all of your cactass.",0
"I may not have a job right now, and I may live in my parent's basement, but I swear to you I'm storing up treasure in heaven and my mansion is gonna rock.",0
"The Lord is your refuge and strength in times of need, but in the meantime I was thinking I could lay hands on you in prayer...",0
I’ve been dreaming about you all night and already my morning is as good as can be.,1
Your boat must be leaking. Need any holes bunged up?,1
You make the Queen of Sheba look like a hobo.,1
"Excuse me, but I think I dropped something. MY JAW!",0
Are you a Sunfish? Because I’d like to find out how tight your cockpit is.,0
Are you a cuddle? Because you are already making me feel good and loved.,1
Baby I got a water gun and I want to shoot a load into your mouth.,1
I'd like your boat to pull in my pier.,0
My boyfriend/girlfriend is prickin’ awesome!,1
"I must get a new pair of glasses, because I cannot believe how beautiful you are.",1
"Roses are red, pickles are green, I like your legs and what's in between!",0
I bet I can guess your confirmation name.,0
Did it hurt when you fell from the sacred realm?,1
I want to put my boner into your pants.,0
What's a celestial girl like you doing in a telestial place like this?,1
"Hey girl, feel my thobe. You know what it's made of? Husband material.",0
Let the gourd times roll!,1
Is your name 'wifi'? Because I'm feeling a connection.,0
I can be your scripture hero.,1
"Girl, did you steal my drum stick? Because my heart missed a beat when I saw you.",1
"Babe, I am a band-aid, and I am about to fix your pain.",0
Is this a strong wind? Because babe I want to see you blow my umbrella away.,0
"If I had a star for every time you brightened my day, I’d have a galaxy in my hand.",1
"Girl, our love is on point.",1
"Hey girl, we're allowed to marry four...but I don't think that's necessary because you're a 10.",1
"Girl, with your love this wood can become a big tree.",1
"If you were a president, you’d be Babe-raham Lincoln.",0
"Hey girl, reading Leviticus with you was so fun! Let's do that again!",0
Let's scan the Bible and pick out baby names.,0
Stick with me. We will go places.,0
I'm looking for a no-strings-attached cuddle buddy.,1
"Roses are red, my face is too...That only happens when I am with you.",0
What's in the box?,1
"Hey girl, God commands us to be fruitful and multiply. What do you say?",0
Your pilgrimage or mine?,1
"Hey, my name’s Microsoft. Can I crash at your place tonight?",0
"Sorry, but you owe me a drink because when I looked at you, I dropped mine.",0
"So, I hear reincarnation is making a comeback.",1
"My favorite letters in the alphabet is F, C, K. And guess what else I need.",1
The only thing standing between you and me is my priesthood; if you know what I mean.,0
These dark clouds and strong wind could not hinder my boat in coming to you my love.,1
I like my women like I like my glasses: Thick and sturdy.,1
"Hey baby, we don’t need to frack to make the bed rock.",1
Life without you is like a broken pencil… pointless.,0
"So, my parents are home, you wanna come over?",0
"The Lord is your refuge and strength in times of need, but in the meantime I was thinking I could lay hands on you in prayer...",0
Would you like to be the lucky guy who gets my real number? Give me your phone.,1
"Romantic comedies and cuddling? No, thanks. I'd rather ride in your truck and have sex.",0
I’m stuck on you.,0
"Do you know the difference between you and the new phone? The new iphone costs $1,000 and you are priceless.",0
I fall in love with you but when I come too deeply it drowns me.,0
Hey girl. Don't worry. I'll be sure to sit next to you during the prayer so that we can hold hands.,0
Is that hand sanitizer in your pocket or are you just happy to be within six feet of me?,1
"Babe, are you missing wood in your forest?",0
Are you my pajamas? Because I cannot fall asleep without you.,1
How about we turn your pretty gown into a nightgown?,1
Girl are you a pumpkin? Because you vine as hell.,0
"You got a band aid? Because girl, love hurts.",0
Are you a secular humanist? Because I want to engage in a rational conversation.,1
"What's long, hard and fits nicely into a hole? The key to my apartment and it's yours.",1
"Girl, I've never been lost at sea, but you making me feel lost tonight.",0
"I was going to send you nudes last night, but then I realized I didn’t have your number.",1
You're gourdgeous.,1
"I'm glad you are wearing non-slip shoes, because if you come home with me it's gonna get real wet.",1
I send the best morning texts. But you’d know that already if I had your number.,0
I noticed that you have the bible app on your phone... I can tell you're a woman of the word.,0
Guy: there's no smoking allowed in church. Girl: I'm not smoking. Guy: Oh yes you are!,1
You must be debt ’cause my interest in you is growing.,1
All these pencils but you still think i'm pointless. You're my sharpener; I'll twist and turn and thrust you inside out till my wood break.,1
Girl are you a percussionist? Because I'll bang you like a drum.,1
"I like my men like the Mississippi River: long, strong, and ready to rock my boat.",0
"Girl, you look like a safe place. I want to drop my anchor into your island.",0
Are you the spirit? Because whenever I think about you I feel a burning in my bosom.,0
Guy sees girl and says: Oh good! Now I can break my fast.,0
"The girl (or guy) walks around the prospect and then grabs the back of their shirt and looks at the tag and says…..”yep, exactly what I thought…..made in heaven”",0
"I consider myself to be fisher of women. This would be referred to as ""casting my net.""",0
Guess what my doctor told me. Laughter is the best medicine. I guess you bring the smile to my face.,0
Are you wifi? Because I cannot live without you.,0
"Give me you cell phone number, I will call you when I need another drink.",1
"Would you rub my magical lamp, because I am about to explode some light into you.",0
"Oops, I lost my number, may I have yours instead?",0
"The 13th Article of Faith requires me to ask you out (If there is anything virtuous, lovely or of good report, or praiseworthy, we seek after these things."")""",1
Now I know why Solomon had 700 wives…because he never met you.,0
I'll let you raise my spin pole.,1
Did It Hurt Comeback: Not as much as this conversation.,0
You rock my boat.,0
Namaste,0
You make my heart beat faster than the starting gun.,0
God was just showing off when he made you.,0
"Hello there, you should use your butt, not your back.",1
"Babe, it's time to examine my comprehensive package.",1
"Girl, you got pencil? Because everything in my life lead me to you.",0
What is a pumpkin's favorite sport? Squash.,0
Did I tell you I'm writing a book? It's a phone book and it's missing your number.,0
"You must be a Jaredite, because you are tight like unto a dish.",0
"I knew I'd feel the spirit at church, but I never thought I'd see an angel.",0
"You've been waiting for God to grant you the desires of your single heart, and I'm certain to satisfy them.",0
I can't wait to see your body of Christ. When you gonna ask me to church?,0
Good morning hottie!,0
"Speak, friend, and enter... your number in my phone.",0
"You look familiar, maybe we've seen each other around, where do you usually go?",0
"Are you an ingenious rock, because I want to date you.",0
Did you drop something? Oh sorry that was just my jaw.,0
Did it hurt when you fell from Heaven?,0
Are you a wifi mesh? Because I feel your love everywhere I go.,1
"Babe, I want to bounce on top of you like the Trampoline Park.",1
"You look so familiar, I think we've met in my dream. It must be the clothes confusing me, mind taking them of so I can cream.",1
"Girl, you must be a pencil, because you really lead me on.",1
"Yeah, I got a bone for you.",0
"I’d rather we started dating earlier rather than later, so give me your number already.",1
Are you an umbrella? Because when I am wet I want to get under you.,0
I feel like God's telling me that you should go on a date with me.,0
Your package for one boyfriend is in route.,0
"My life is the alphabet. Without U, it's incomplete.",0
Do you wear glasses? Maybe you should take them off and have a blind date with me.,0
Is stealing my heart breaking the 8th Commandment?,0
Are you unemployed? Cause I've got a position for permanent cuddle buddy open in my heart.,0
I have to wear sunglasses when I'm around you because your halo shines so bright.,1
"Girl, you know how to hit all the keys for me.",1
Are you shoes? Because I want to slide into that.,0
10% of me is 100% certain that I can give you 10% of my heart forever.,0
"I don’t have a library card, but do you mind if I check you out?",0
My Liahona pointed to you.,1
"Babe, are you a garbage dump? Because I want to dump my junk inside you.",1
"Babe, do you have a bank loan? Because you sure have my total interest.",0
"Hey girl, that smile comes with a cuddle.",0
Now I know why Solomon had 700 wives…because he never met you.,0
"Hey girl, let's combine our starstuff.",1
"I've been reading Joshua, but how many times do I have to walk around you before you fall for me?",1
Hey girl. Bathsheba had nothing on you.,1
Are you a spooky scary skeleton? Because I wanna send a shiver down your spine.,1
I was a lonely sock until I met you. Now the pair is complete.,0
This coffee is steaming up my glasses… Or is that you?,1
King Solomon may have been wise…but I'm more of a one-wife guy myself.,1
Would you do me the honor of inputting your digits in my phone book? I’d like to continue this conversation later.,1
"Babe, do you want to be filled with some fresh life energy in the morning?",0
"We don’t know when the boat will flip and toss us apart, but we should keep on sailing.",1
Twist: Are you from Tennessee? Because those teeth are the only ten I see.,1
Wanna come over and watch Left Behind?,1
"Like all great projects, our relationship is off to a rocky start. You made me hard.",1
Do you want to be my morning? I could make you come after every night!,0
You are fancactus.,0
"If you gave me your number, I’d give you something even better.",0
"You must be the promised land, because my liahona is pointed right at you.",0
You dropped something today. Your smile.,0
Are you a package? Because I want to track you down and bring you home with me.,0
"Girl, you have stolen my drum stick, because you are hard to beat.",0
"Girl, I am a drifting boat until I met you. You give me meaning.",1
Should I call you in the morning or just poke you?,1
"Roses are red, your underwear is lace, take them off and sit on my face.",0
"If I could rearrange the letters of the alphabet, I'd put U and I together.",0
Does your mom care that I'm in your boat?,0
Is your name Grace? Because you're amazing.,0
There's nothing more I love than stacked dimes.,0
I would part the Red Sea for you.,0
"Here I am, the answer to your prayers.",1
Has anyone ever told you that you have beautiful eyes?,0
Quads. We can bang in four different tones.,1
Did it hurt when you fell from heaven?,1
"I must be a Rubik's cube. The more you mess with me, the harder I get.",0
"Girl, you turn my low key into high key.",0
Hey guess you can kiss heaven goodbye. Because it has to be a sin to look that good.,1
The tree of life called. It wants its sweetness back.,1
Are you a shoe? Because I wanna tie you up,0
I want to pound you like I pound the asphalt: For hours until it hurts.,0
"Others may try to surpass your physical beauty, but your spiritual beauty is beyond the constraints of this world.",1
Is it a sin that you stole my heart?,1
Damn girl are you a Rubik's cube? Because I need to google how to do you.,0
"I got a nice ship, and I am not afraid to get down and wet tonight.",1
I was so enchanted by your beauty that I ran my boat into yours.,1
I've never used a cum sock before. Would you be my first,1
"Hey, so I play drums for a living if you want a good pound.",0
"You look familiar, have I probed you before?",0
"Babe, you look familiar, because I have been thinking about you all my life.",0
Girl: Um there's a hotel somewhere around here,0
You have been chosen by the Dark Lord to be defiled on the ceremonial altar. It's quite an honor.,1
"I lost my Teddy, can I cuddle with you?",0
"Hey sweetheart, do you like gardening? How about you plant your tulips on mine?",0
Are you a garbage truck? Because I am trash looking for some fun.,0
"Hey baby, I've got my sights on you.",0
"Should I text you tomorrow morning, or do you want me to wake you up with my kisses?",0
It's obvious you sprouted from the good kind of soil.,0
"Babe, I know we just met and all but here’s my number, could you call me maybe?",1
Are you a dictionary? Cause you’re adding meaning to my life.,0
Give me your name so I know what to scream tonight.,0
I just got off my mission and I’m looking for my next companion.,0
Have we met before? You look familiar.,0
"No matter how scrambled you are, I will always make the right moves to solve you.",1
"Babe, you don't need no wifi speed test, I can connect into your device directly.",1
You can call me FedEx. Because I’m gonna violently thrust my package at you.,0
You up for some boning later?,0
"Hey babe, I can make you scream louder than my drum set.",0
"Like the Bible says, I guard my heart. And you just set off my security alarm.",0
"I love our mornings together, because it points to another day with you in my life.",0
Are you a microwave? Because you turn my frozen soul into a hot meal.,0
Guy - You look like my first wife.,0
I’m gonna put on my glasses. Before I talk to you'll want to focus on my future.,0
Do u have a pencil I can borrow? Because i wanna erase your past and write our future.,0
Are you a mechanical pencil? Because I’ll never have a dull moment with you,0
I love my life. Would you share it with me?,1
I've got you in my viewfinder.,1
"Girl, let me tie your shoes, and I can do so much more.",1
You know what the temple veil and I have in common? We're both ripped.,0
"Are you rosey, because you making me feeling thorny.",0
"What's your favorite temple? (he/she answers) Baby, I'm lookin' at mine!",1
“I know what I want because I have it in my hands right now. You.” — P.S. I Love You,0
Are you a toy at build-a-bear workshop? Because you’re cute and I wanna cuddle you in my bed after I stuff you.,0
"Gee, that's a lovely scent of incense you're burning there.",0
"If you were a pencil, I wouldn't be able to use you. Because you're no number 2, you're my number 1!",1
Are you a gadiaton robber? Because you just stole my heart!,0
"Babe, did you throw a piece of garbage? Because I am ready to get down and dirty.",1
"Babe, I promise I am not faster than the speed of light.",0
What do we have in common as socks? We can be mated.,0
Are you my cute pillow? Because I want to wipe my tears on you and cuddle with you.,0
Do you play soccer? Because you’re a keeper!,1
Are you a broken light? Because you keep giving mixed signals.,0
Does your cat go into the water? Because my boat needs some pussy tonight.,1
Do you want to hear a cheesy flower pick-up line? Let’s put our tulips together.,1
Use protection while you get wet... Like an umbrella.,0
I wanna bang your bass drum.,1
"If my wallet look like a bible, it's only because the Word of God is ore valuable to me than gold.",0
"Hey girl, are you a broken light bulb? Because I want to screw and take you out.",1
Hi. My name is Will... God's Will.,0
Are you a loose shoelace? Because I want to tie you up nice and tight.,1
Are you Muslim? Because your body islamin.,1
Ready to have a gourd time with me tonight?,1
Is your relationship on the rocks? I have some alcohol for that!,0
"Guess what, I can tell how much you weigh. Only if you sit on top of me.",1
"I got an umbrella that you should carry, because I will take care of you when you feel under the weather.",1
Let's wear our pajamas today and live life to the fullest in bed.,0
Are you a pumpkin ? Because I'm looking to smash.,0
You must be the speed of light because time stops when I look at you.,0
Pray here often?,1
"I'd like to be reincarnated as one of your tears, because I'd be born in your eyes, live on your face, and die on your lips.",0
Of all the rocks in all the mountains. I'd pick you.,0
I am just a small rock before I met you. Your love has made me bigger and boulder.,1
Interested in team blindfolded?,0
Are you Arsenal? Because you make me anna shoot my gun.,0
Are those lenses in your pants or are you just happy to see me?,0
"Are you a wifi signal? Because you're not mine, but I'll try to use you anyways.",0
I don't think you're worthy to take me to the temple. [Why?:] Because you're smokin'!,0
How about you and me get some fish this Friday?,0
"Hey you look familiar, are you from this town?",0
Let's cuddle and wake up in 10 months when September ends.,0
You know why Solomon had so many wives? It's because he never found you.,0
Let's get out of here. I know a much cozier little Catholic bookstore downtown.,0
The Holy Spirit compels me. I can't help but draw near to you.,1
"How about you be the salt, and I'll be the light.",0
"You might not be a nun, but you will be missionary tonight.",0
"I don't know if you noticed but, when you walked into the room, that was me giving up a clap offering.",0
Permission to board?,0
Give it to me RAW.,0
I don’t care if you make six digits. I just want your seven digits.,0
Is your name virtue? Because you garnish my thoughts unceasingly.,0
Damn girl! I don’t need a magic mirror on the wall to know that you’re definitely the finest of them all!,1
Best loves stick.,0
I cube and I'm master of advanced finger tricks.,1
"Babe, I got a microwave and things about to get really hot.",1
Do you believe in love at first sight — or should I walk by again?,0
It makes my head spin to see you serve food to those homeless people. You're such a servant.,0
You're nothing like a Glock. You look like good for my cock.,0
"If I had four quarters to give to the cutest guys in the world, you would have a dollar!",0
Are you baptismal regeneration? Because you make me feel like a new man.,0
"You so gneiss, I will never take you for granite.",1
"(While dancing) You know, I'm really grateful for Martin Harris. Without him there'd be another 113 pages between us.",0
Your hair is like a flock of goats descending from Gilead.,0
"Baby, are you America's lax gun laws? Because I'm going to exploit all of your holes.",1
Are you a microwave? Because I want to stuff you and turn you on.,0
Wanna be a sister wife?,0
We have so much chemistree.,1
You are so unblemished that I would sacrifice you.,0
"Girl, you take me back to elementary school. I say my ABC’s to you.",0
"Hey baby, are you a tsunami? Because you can rock my boat all night long.",0
Guy: Excuse me I'm on a Mission could you provide me with some Lodging.,0
What do you say we bounce like trampolines.,1
"Girl, if you wanted I can be your umbrella.",1
You remind me of the Ka'aba. I can walk around you all day long.,0
Mirror mirror on the wall. You are the finest of them all.,1
You rock me to my core.,1
Need an umbrella? You can open me over your head any time.,1
"Roses are red, violets are blue. Sugar is sweet, I bet that pussy is too.",0
"I’m going to give you a kiss. If you don’t like it, just return it.",0
"Babe, the only thing I ain't dropping is my standards. And that is why the only one I want is you.",0
"I have a phone, you have a phone number. Think of the possibilities.",0
Would you like to share my prayer-mat?,0
"Girl, did you drop something? Because here's the $100 that my friend bet that you wouldn't go out with me tonight.",0
"Girl, I got a magic band-aid to heal your heart.",0
"Girl, do you have a toaster? Because you make me hard.",0
Are you from Tennessee? Because you got the sexy accent.,0
"You, me, candles, wine, and a little Lamb of God?",0
Let this boat be our shelter under the stars.,1
"Hey baby, can I get your phone number? Oops, too late.",0
You cant play basketball with hijab on. Marry me and we'll go one on one our entire life.,1
You look like trash. Can I take you out?,0
What size shoes are you? Because I want to prepare the right sandals when you stay tonight.,0
I'm dying for you to bone me.,1
That hijab really compliments your eyes.,0
"Babe, I got no ABC's in my dictionary, I only got DTF.",1
Do you offer loans? How much interest do I have to pay to borrow your titties night.,1
It's obvious you sprouted from the good kind of soil.,0
"If you have tulips and i have tulips, want to put them together and make a Kiss?",1
"So last night I was reading in the book of Numbers, and then I realized, I don't have yours.",1
Your skeleton with be better next to my bed.,1
"Are you glasses, cuz I'd love if you would sit on my face all day.",1
Let me sell you an indulgence because it's a sin to look as good as you do.,1
"Roses are red, violets are blue, how much I love you is beyond your clue.",0
"Are you a magician? It’s the strangest thing, but every time I look at you, everyone else disappears.",0
"I like pajamas like I love my woman, comfortable and tight.",0
Do you know how to send a mirror through text? I wanted to send you a cute message and you're the cutest thing I could think of.,0
"Girl, you are so hot, I need to inspect your package for any explosives or hazardous materials inside.",0
Nothing turns me on more than a long hard rock and some tuber.,1
You don't need to be a bridge loan to close the GAAP between us.,1
God must have spent a little more time on you!(from a song),0
"You know, God is pure beauty…I see a lot of God in you.",1
How can I know so many hundreds of digits of pi and not the 10 digits of your phone number?,0
"(For the ladies) Excuse me, I believe one of your ribs belongs to me.",1
Have I met you before? (No) Not this lifetime? It must be our previous lifetime.,1
"We belong together like a pair of glasses, I want to insert my lens into your frame.",1
Let me sell you an indulgence because it's a sin to look as good as you do.,0
Are you a bank loan? Because I got interest for you.,0
