Are you a supermarket sample? ‘Cuz I wanna taste you again and again without any sense of shame.,0
"If I’m vinegar, then you must be baking soda. Because you make me feel all bubbly inside!",1
Guess what I’m wearing? The smile you gave me!,0
"Is your name Charity? Because if I don't have you, I'll be nothing.",0
You know they say that you have never really dated until you've dated a Catholic.,1
"Baby, you're a drummer? I can make your heart go offbeat.",0
I left my keys at home. But babe I can always come in through the back.,0
"Hey baby, (give 1 plastic rose) I promise to love you until the last rose dies.",0
"Girl you must be blue, because you're the hottest star around right now.",0
Are you a new pair of socks? Because you right in all the right places.,1
"Hey baby I play bass drum, so you know I could give you a deep bang.",1
"(to a guy) Wow, big strong man like you… you must be one of God's soldiers…",1
Do you want to be accountability partners?,0
"It must be Laylatul Qadr, because that's the night that angels come down from Heaven.",0
"Babe, I got the perfect camera, now I just need all night long to get you perfects shots.",0
"Hey girl, I just saw the moon in your eyes... Eid Mubarak.",0
"You are perfect, except with all the sin.",0
"I have a huge, huge umbrella collection.",0
"You look familiar comeback: I know, I killed you once before?",1
You look good with skeletons.,0
Want to cube?,0
Are you the sacrament of Confirmation? Because you complete me.,0
Did you just come out of the oven? Because you’re hot.,0
"I'm not a morning person, until the day I work up next to you.",1
I can be a little prickly.,0
Are you trees in the grasslands? Because you are on fire and we should do something about it.,1
"In honor of Earth Day, I'll rock your world.",0
"Girl, I want to drop my package into your warehouse.",1
I’ll bring you roses to our first date so that they can see how beautiful you are.,1
"Hug and cuddle won't be the same, without U.",0
Buddha said every relationship in your life is a reflection of you. I can see myself in your beautiful eyes.,0
Did it hurt when you fell from heaven? Cause I can treat you right.,1
A skeleton isn't the only one who can put an arrow through my heart.,0
Are you a cactus? Because I am stuck on you.,0
Do you have a name you want me to save you as in my phone or should I just put 'mine'.,0
Wanna prove our non-existence?,1
I should charge you rent for spending so much time in my head.,1
"Girl, I got a huge pumpkin in my pants. I'll make you go 'oh my gourd' all night long.",0
"Girl, you are so hot, you are giving me accidental discharge.",0
Pray here often?,0
"Baby, you're the light in my corona.",0
I should tie my shoes. But it's too late now because I am already falling for you,0
"I know you've already said no once, but call me Joshua because I'm going to break down your walls.",0
Know what’s on the menu? Me ‘n’ u.,0
Do you know what's a skeleton's favorite instrument? Sex-a-bone.,0
Hey gourd-geous! Wanna go back to my place and squash?,0
Let's be like Noah and do this as a pair.,0
"“You need kissing badly. That’s what’s wrong with you. You should be kissed often, and by someone who knows how.” — Clark Gable, Gone with the Wind",0
"If you were to be as rich as your number, how much are you worth?",0
Doesn't the Bible say to 'greet one another with a holy kiss?,0
"Babe, are you ready to experience my tongue ABC?",0
I got the blocks and leverage to move you tonight.,0
Pumpkin pi.,0
Let's just say I like to package your goods.,0
Are you an app? Because your life isn't complete until I drop my plugin.,1
"Did you say your name was Esther? Oh, I guess I just think you were chosen for such a time as this.",0
Are you the alphabet. Because you make up every written word in my world.,1
"Babe, I've got a maple tree that you could suck the sap out of.",0
Are you a parking ticket? ‘Cause you’ve got “fine” written all over you.,0
"I would take you to the movies, but they don’t allow snacks.",0
You already have a whole skeleton inside you so another bone will do no harm.,0
"Morning cereals, soup, you. Those are the things I want to spoon.",0
"You got the goods, babe I'd motor boat you any time.",0
Are you a microwave? Because I want to put my hot dog in you until it explodes.,1
“You are a unicorn beyond my Minotaur. You are a eureka beyond my maitai. You are a Yuletide beyond my minesweeper. You are a euphemism beyond my myna bird.” — Harryette Mullen,0
"Hey girl, are you a wither skeleton? Because I want your head.",0
Are you the online order I placed a few days ago? ‘Cuz I’ve been waiting for you all day.,0
Are you a band-aid? Because I am about to feel better once you cover me.,0
"I'm no Joseph, but I'm having trouble interpreting the dreams I've been having about you.",0
Can I double tap your bouncing trampolines.,0
Let's stick together.,0
"You’re kinda, sorta, basically, pretty much always on my mind.",0
Doesn't the Bible say to 'greet one another with a holy kiss?,1
"The alphabet begins with abc, numbers begin with 123, music begins with doremi, and love begins with you and me.",0
I hope you’re a geology major cause I need you to take a look at this rock in my pants.,0
"Babe, I like the way you bounce.",0
Girl you need a toaster? Because things will definitely get real toasty with me tonight.,0
"Babe, did you lose your stuffed animal? You can always cuddle with me.",1
"Hey, do you have a band aid? I skinned my knee when I fell for you.",0
Girl are you from Tennessee? Because I’ve got a 10 incher that you gotta see.,0
Nice bible,0
Wanna see how handle my tripod?,0
"Just like the boat, my heart swings back and forth to the oceans every time I see you.",0
"You want to do something? Sure, let's go pray.",0
"Good morning babe, you are my sweetest dream come true.",0
You're not old enough to go to the church dance. Let's make out instead.,0
Are you microwaveable? Because I will feast on you tonight.,1
"Roses are red, Violets are blue. The garbage is dumped, now so are you.",0
We are all connected on a deeper level.,0
Are you my glasses? Because I always hate it when I lose you.,0
Catholics don't shake hands; Catholics gotta hug!,0
Would you like to have bamboo sheets on your bed? Because I want to cover you with sustainable love.,0
Hey I love your shoes. You know they would look even better if they were walking next to me.,1
Would you like to come over and meditate with me?,0
"Babe, I am not going to shoot blanks tonight.",1
"Here's the key to my hour, my car, and my heart.",1
You're looking a knight in shining armor. I just so happen to be wearing the armor of God.,1
You be the fish and I'll be the loaves. Let's let Jesus make a miracle out of us.,1
"Why don't you come back to my place, and we can do some world-shaking of our own.",0
"You must be a ship, because you have always been on my radar.",1
You look so familiar! I swear I've seen you before in my piggy bank because you are a pretty dime.,0
"Without you in my life is like a boat without a crew, it is directionless meaningless.",1
"“I don’t bite, you know… unless it’s called for.” — Regina Lampert, Charade",1
"Girl, I want to wear you like my glasses, one leg over each ear.",1
"You're sweet, sexy and powerful. Just like my Colt.",1
Are you the Goddess of Life? Because you just made my tree grow.,1
"You are perfect, except with all the sin.",0
Are you a Maple tree? Because I would tap that.,1
I love the way your Abaya flows when you walk.,1
Hey girl are you from Tennessee? Because I was wondering if you’d still be interested in me if I wasn’t your cousin.,1
That's a nice burka. Can I talk you out of it?,1
Are you a light? Because you brighten my day.,1
Rise and shine babe! I will light you up with some sweet afterglow.,0
Are you band aid? Because seeing you patches my broken heart.,1
"People call me trampoline, want to get up and down on me?",0
I'll put the wind in your sails if you raise my mast.,0
Are you rocks? Because I am a geologist that will date you any time.,1
Did you know there are 206 bones in the human body? Would you mind one more?,0
"I had a bad day, it won't be anymore if I got to cuddle you.",1
I always practice good seamanship.,0
I bet you're even prettier in temple white.,1
"So get your tiny butt over here and let's watch Netflix and cuddle, eh.",1
"Babe, if you can handle my cheesy pick up lines at night, you can definitely handle my morning glory.",0
"On the flip side, your clothes look so cuddily and soft that we should cuddle.",0
I was blinded by your beauty; I’m going to need your name and phone number for insurance purposes.,1
I just received a message from the Holy Ghost that you are supposed to be my wife.,0
"Girl, I just made a wish. Because I just mistaken your eyes for the wishing star.",1
"If you were a chicken, you’d be im-peck-able.",1
Not much… Wojtyla doing later?,0
Do you have band aid? Because you will need it when I done with you.,1
"Hey girl. Unfortunately, I can't perform miracles, and I only have enough fish and bread for two people...",0
"What!?!?, Friends listen to Amazing Grace in the dark!",1
"Baby, you've bought yourself a cruise on the Love Boat. I'll be your captain.",0
"Is that a number 2 pencil in your pocket, or are you just happy to see me?",1
"I might not look like it, but I can really cover you when I open myself up like an umbrella.",1
"Roses are Red, Colors are Hue. I will do anything just to have you",0
My magic watch says you want to cuddle in five minutes. Do you?,1
"It's not about the size of the boat, it's about how you sail you.",0
"Look, you're nearly 22. Most Christians are three years into marriage by now…just settle for me.",1
Why do we even need guns anyway. You have me.,0
Are you aware of the ongoing coin shortage? Because you’re the first dime I’ve seen in a long time.,1
I don't want to be under the cork tree. I want to be under YOU.,1
"So last night I was reading in the book of Numbers, and then I realized, I don't have yours.",1
You make the Queen of Sheba look like a hobo.,1
"Babe, you are so hot you make me feel like I have 1 extra bone.",0
"“I gotta warn ya, every man I’ve ever gone out with has been ruined.” — Bugsy, Pretty Woman",0
"They say Disneyland is the happiest place on earth. Well, apparently, no one has ever been standing next to you.",0
"Do you believe in love at first drum, or should we bang again?",1
Looks like you've unboxed the key to my heart.,0
This ship could take you a thousand miles and could take you toward my heart.,1
"I'm sorry, but you don't just have a sweet spirit... If you know what I mean.",1
You're a Galatians 5 fruit salad.,0
"Hey, what's your name? [Insert Name:] Hmmm, that sounds familiar... I think it was in my Patriarchal Blessing!",1
I carry my cell phone not to feel important but so I can call you when I miss you.,1
You're such a dime I could just use you as a ball marker.,1
You just broke a commandment by stealing my heart.,1
Are you a star in the desert sky? Because you light up my world.,1
"Girl, you will love my prick.",1
I’m not Fred Flintstone. But I bet I could make your bed rock.,0
Are you a microwave? Because I want you to pop my corn.,0
I can do magic with this cube. My fingers can do even more.,1
"Hey girl, you dropped something. My pants.",0
"Girl, guess what lasts forever? My love for you.",0
Is your name Grace? Because you are amazing.,0
Babe I am a skeleton without you. You are the one that gave me heart.,1
"Hello, I’m a thief, and I’m here to steal your heart.",0
Girl you a mechanical pencil? Because I want to take you apart and put you back together in my life.,0
You'll always be the second woman in my life. Our Lady is first.,1
You look familiar. Maybe I follow you on Instagram.,1
Nice shoes. Wanna screw?,1
"Hey, can you help me get to a doctor? My heart keeps skipping a beat when I’m with you.",0
True love can never be captured by camera.,1
"I may not have a job right now, and I may live in my parent's basement, but I swear to you I'm storing up treasure in heaven and my mansion is gonna rock.",1
You don't need keys to drive me crazy.,0
"Roses are okay, violets are fine. You be the 6 and I’ll be the 9.",1
Are you a delivery person. Because I want you to handle my package gently.,1
"On a lazy Sunday: Netflix all day, getting lost in a museum, or cuddling with me?",0
If you get with me you will never have to reload again.,0
Can I borrow your cell phone. I need to phone heaven and tell God I found the missing angel!,0
Babe ahoy!,1
You like tulips? How about putting tulips on mine?,1
If i could choose any alphabet. I would still choose u.,0
"If you think I’m good at flirting now, wait until you flirt with me over the phone.",1
"Girl, do I own you any loan? Because I am about to get loan payoff tonight.",1
"Guess who? You, because out of all the girls I picked you.",0
I hope you are a long term loan? Because I want to keep you for life.,0
What time do you have to be back in heaven?,1
You are what is making every morning worth waking up for.,1
Are you a Rubik's cube? Because I'll solve all your problems,0
"Roses are red, so are your lips...You should sit on my face and wiggle those hips.",0
I think it's cute when we're in the car and you turn down the music when a swear word is coming up.,0
"Girl, I know the perfect breakfast for you. Cheesy pick up lines, hot sausage patty, and let's finish it with some tasty cream for your coffee.",1
"Guess if you are one of the boys, I must be homosexual.",1
I've had to fast every day since the first time I saw you.,1
"Girl, are you missing a trampoline? Because I am never bouncing on you.",0
"For score, seven years ago...I would have rocked that butt.",1
If you were a boat I would keep you in my garage.,1
"Are you a metamorphic rock, because I am going to turn you on according to varying temperature and pressure.",1
"You must have strong signals, because the cell phone in my pants just got full bars.",1
They say cuddling is the most romantic thing in life. Do you wanna try with me?,1
“You might not have been my first love but you were the love that made all other loves seem irrelevant.” — Rupi Kaur,0
Your lips look lonely. Let me introduce them to mine.,0
I hope you’re a doctor because I am sick for your love.,1
Is your name David? Because I wanna be like Goliath and fall for you.,0
"I usually pick up trash, but today I want to pick you up.",1
Are you a tree? Because you are giving me plenty of wood.,1
I got the prick to satisfy you.,1
"You are like my soulmate, if I had a soul.",0
What do you and hell have in common? You're both Hot!,1
"Girl, you look very familiar, perhaps we have met in another life.",1
Are you a drum because I want to tap that.,0
"Baby, you're the only lock that fits my key.",1
You know you remind me a lot of a toaster? Warm on the inside. Makes soft things hard. And a shower with you would probably kill me,0
Let me wake you up for the rest of my life.,0
"I cannot find my keys, I am missing the one key to your soul.",1
"Roses are red, violets are blue. DaVinci painted Mona, cause he couldn't find you.",0
I'm luckier than a PLL skip.,1
"Trust me if I say you are my rock, I really dig you out of the ground.",1
Did it hurt when you turned to logic and reasoning?,0
"I might look cute, but babe I am hard to handle.",0
I’m ready to take it from cacti to cactus.,0
"When I first saw you, I said mashallah and then I said inshallah.",1
"You know what they say, geologists know how to make the bed rock!",1
"Girl, are you from the Amazon? Because you’re the full package.",0
"Call me cactus, because I am the sharp guy for you tonight.",0
"I didn't believe in reincarnation the last time, either.",1
Babe I love your guns. I want to fill you up with my projectiles.,1
"Do you have the time? (Tells you the time) No, the time to write down my number?",0
I was wondering if you had an extra heart. Mine was just stolen.,1
I'll be your umbrella for any rainy day.,0
"I don't believe in Christianity, but you can talk to my snake anytime.",1
Be my drum and I'll bang you with my stick tonight.,0
"Give me your phone number, I bet it would look better on my phone than in your head.",1
"Girl, you are so hot you cock and reload my gun with just a look.",1
You are the light that I have been searching for.,1
Simple having a conversation with you right now makes my day whether you give me or not give me your phone number.,1
You remind me of the sun. Because your light shines on me.,1
Wanna go up to the roof… and pray?,1
"Babe I got no pumpkin pie for you, but I sure got some cream pie.",0
"Excuse me, I think I left my jacket on your bedroom floor. Oh, shoot. I messed it up again. That’s tomorrow morning!",1
"You are locking good, and babe I got the right key to enter you.",0
Do you need prayer? Because I'm certainly willing to lay hands on you.,1
You look so familiar… didn’t we take a class together? I could’ve sworn we had chemistry.,0
"Nice shirt! What’s it made of, boyfriend material?",0
"“How would you like to have a sexual encounter so intense, it could conceivably change your political views?” — John Cusack, The Sure Thing",1
"Hey girl. Unfortunately, I can't perform miracles, and I only have enough fish and bread for two people...",0
A - U r Attractive B - U r the Best C - U r Cute D - U r Dear.,1
"Roses are red, violets are violet. Here is my number why don’t you dial it?",0
"If you were a trampoline, I want to dive into you.",1
"Babe, there are only two letters to describe me in the alphabet. E Z.",1
If I could rearrange the alphabet. I'd put U and I a few letters apart. We still need our personal space.,0
"Roses are red, sunflowers are yellow. Both are beautiful but I prefer you.",0
Can I have your number? So I could text you before I deliver my package to your home.,1
"Roses are red, Violets are Blue, Tulips are cute, can I have your number?",1
I left my Wi-Fi on and it's telling me that you are a hotspot.,1
I'm not much for boats. But I can see myself in a ship with you.,1
You looking sharp.,1
"Honey, your smile makes the morning seem dark.",0
Looks like your boat needs some seamen and I have the perfect crew.,0
I wonder if your package would fit in this tight door slot.,0
Are you a skeleton? Because I want to put some flesh into you.,0
Can I put my gun in your holster?,1
Are you my glasses? Because I have been looking for you.,0
Say hollow to my little friend!,0
You like Jesus? I like Jesus! we could go like Jesus together…,0
"Girl, you don't have to walk a mile in my shoes, just get naked in my bed.",0
"Hey, I heard about this great birthday party, you wanna go? (Christmas)",0
Life without you is like a broken pencil...... pointless.,1
"Hey girl, wanna plant a tree with me?",0
"Hey there, have you been touched by the great noodly appendage?",1
"I have a bible verse tattoo, it's permanent, it's also in ancient Greek.",1
"Hey girl, are you a tree? Because I want to chop you up with an axe.",0
Is your name virtue? Because you garnish my thoughts unceasingly.,0
"I hope you have a big box, because I'm stuffing this oversized package in it.",1
I'd say the first thing you need is … a pumpkin.,0
I might not have inches. But its not the size of the boat its the motion of the ocean.,0
Hello. Cupid called. He wants to tell you he needs my heart back.,0
Call me microwave. Because I can pull it out when it gets hot.,0
"So, are you going to give me your phone number, or am I going to have to stalk you?",0
"Hey girl, are you a mirror? Because I get the feeling that smashing you is bad luck.",1
Rub me until my light comes out.,0
"Hey girl, I know when Septuagesima starts.",0
Come Back: Too bad you are a one.,0
"When I'm not there when you wake up, that's just me playing god.",1
I am here to share something important to your eternal salvation with you.,0
"Girl, I want to be your shoes because I want to be with you every step of the way.",1
You're my eucatastrophe.,1
Let’s go make my Plymouth rock.,0
“Do you have a name or can I call you mine?” — Unknown,1
Are you religious? Because you’re the answer to all my prayers.,0
"I consider myself to be fisher of women. This would be referred to as ""casting my net.""",0
"Aside from being sexy, what do you do for a living?",1
Babe did you drop something? It's a VIP ticket to a breakfast in bed at my place.,1
"Babe, time to sheet in and bare away.",0
If I got a rose each time I thought about you I'd keep walking in my garden forever.,0
"Hey girl, whenever I read Proverb 31, I think about you.",0
"I heard that Tim Keller's book, ""The Meaning of Marriage,"" is pretty great. How about we read it together and discuss?",0
"I must be a pumpkin, because you’ve carved a smile into my face.",1
"Roses are red, Lemons are sour...Spread your legs and give me an hour.",0
"Babe, I got a hard pine tree for you. Hug it and your hand is about to get really sticky.",0
"If your lips are your great weapon, would you care to test it against my guns?",1
I’ll show you my girdle if you show me your sock garter.,0
Hey girl you look sad. Wanna cuddle?,0
You dropped something yet? Because you are about to drop your panties for me.,0
You have great child bearing hips.,0
"Hey girl, do you believe in the survival of the fittest? Because I want to celebrate triumph your fine ass.",0
"You must stole the key to my heart, because you are a keeper.",0
Hey you want to go watch Religulous and bang?,0
For you I would slay two Goliaths!,1
"Do you like blueberries or strawberries, ’cause I want to know what kind of pancakes to make you in the morning.",1
"Hey girl, I can cuddle you like I cuddle dogs",1
Is that a boat paddle in your pocket or are you just happy to see me?,0
"Roses are red, violets are blue. I cry myself to sleep dreaming of you.",1
Do you have a skeleton in your closet? Maybe you should.,0
"Sorry, I would’ve texted sooner but my phone just overheated. I guess you’re just too hot for tinder.",0
"Babe, you could pick on my bone any time.",0
Do you like gardening? Because I'd love to put our tulips together.,0
What do you say we go down to the gun range and blow some loads together.,0
You so hot you just rocked my socks off.,0
Don't I know you from the pre-existence?,1
"Alphabet pick up line come back. I like it the way it is, with N and O together.",0
"Are you a mud rock, because you sure look fine to me.",1
You can stand under my umbrella.,0
Do you like the fantastic 4? Because I have something that's rock hard going down.,1
"Girl, I want to bury my skeleton into your graveyard any night.",0
I just cleaned my whole house and now I'm the only trash left. Will you take me out?,1
Are you religious? Wanna drink with me and sleep in together Sunday morning.,0
I think I may need glasses because all I can see is you.,0
"Can I sing my ABC's to you? A, because you're Awesome. B, because you're Beautiful. C, because you're Confident. And I'll give you a D, because you deserve it.",1
"Girl, you so fine, I'd give you up for Lent.",0
"Hey girl, are you the Rubik's Cube? Because it's hard to complete you in the beginning, but I can get you to cum faster and faster.",0
I lost my teddy bear. Can I sleep with you tonight?,0
There's 20 letters in alphabet. Because you took away U R A Q T. And I got the D for you.,0
May I offer you a light for that votive candle?,0
I know we aren’t socks. But I think we make a great pair.,1
What's cookin' gourd lookin'?,1
"“I appreciate this whole seduction thing you’ve got going on here, but let me give you a tip: I’m a sure thing.” Vivian, Pretty Woman",0
What's your theological world view?”,0
I think I just met the 13th gift of the Holy Spirit.,0
"It's not the size of the boat, but how fast it sinks.",0
"Girl, you are so hot you make my lazy bone work.",0
My fogged up glasses can't hide that you're smokin' hot.,1
“I’ve fallen in love. I’m an ordinary woman. I didn’t think such violent things could happen to ordinary people.” — Brief Encounter,1
"Babe you look familiar, beautiful. beautiful is the word.",0
"Life without you is like shoes without laces, I want you to tie me up.",0
Go big or gourd home. How about do both with me in bed.,0
I miss you like the Book of Mormon missed the Bible during the Great Apostasy,0
Are you an umbrella? Because today is pouring and I want to pick you up.,1
Are you my camera? Because you made me smile everytime i look at you.,1
"I didn't have enough of you last night, can I have more tomorrow morning?",1
"The word says to 'Give drink to those who are thirsty, and feed the hungry'; So how about dinner tonight?",0
"Girl, did you have my ABC today yet? A Big Cock.",0
Will you help the cause of the Ummah by helping me complete half of my deen?,1
Are you dance shoes? Because I wanna tap that.,1
Guess what is my favorite tea? I would say you Hot tea.,0
Are you a fireman? Because you came in hot and left me wet.,0
Are you a good cuddler? I might let you join my gang.,0
"I want to be your socks, so you can count on me to keep you warm.",1
Babe you are Rubik's cube? Because I want to lube you before playing.,0
Girl you got light? Because I want to turn you on in the dark.,1
You look familiar comeback: Do you want a lot of porn?,1
If we were trees. We'd be of the same species.,0
Wanna prove immaculate conception wrong?,0
"I would say Good Morning to you, but I already have you in my mind as soon as I woke up.",0
I've got a tree you could trim.,0
"If we’d share a garden, we’d put our tulips together.",0
