"If you were a book, you’d be fine print.",0
"Hey girl, God commands us to be fruitful and multiply. What do you say?",0
You wouldn't happen to have an extra pencil on you?,0
(for the gentleman)God said it is not good for man to be alone. So how about it?,1
Are you the iron rod? Because I wanna hold onto you for the rest of eternity.,0
You don't have an accountability partner? Me neither!,0
"Call me trampoline, because you can bounce on me all you want.",1
"I know Halal meat does a body good, but wow, how much you been eatin'?",1
"They say to love another person is to see the face of God. Well let me tell you, I think I am seeing His face",0
"Babe, I got a pencil and I am ready to rewrite our future together.",0
"Girl, are you trash? Because we are about to get wasted tonight.",0
"Hey babe, I got this flaming sword from an angel and now I want to pass it in to you.",0
"Man we steppin' out like whoaaa, cameras point and shoot. Ask me what's my best side? I step back and point at you.",0
I’m winning this race to get your number. Are you game?,0
I bet you a dollar I can kiss you on the mouth without touching your lips. *kisses her on the lips* - I guess I owe you a dollar,1
I was not checking him out. I was admiring how the good lord has blessed him.,0
Are you a gun? Because I wanna put you in my mouth.,0
Are you a drummer? Because you know the beat of my heart.,0
Can I borrow your pencil? Because I’d like to erase your past and write our future.,0
Do you need prayer? Because I'm certainly willing to lay hands on you.,0
Do you know what would look really good on you? Me.,1
You've got stunning scapular-brown eyes.,0
You can't spell EVOLVE without LOVE.,0
Should I walk by again or have you already realized I’m your soulmate?,1
Roses or Daisies my love?,1
Do you need a band aid? Because it must hurt when you fell from heaven.,1
"If we were around with Noah… then you, me… pair!",0
"Babe, are you a toaster? Because you are steamy and hot on the inside.",1
May I tie your shoe? Because I can't have you fall for anyone else.,0
You're like an island where everyone wants to dock his ship.,0
I will stop loving you the day that an apple grows on a mango tree.,0
"Girl, you are not just a dime a dozen. You are my full dozen.",0
I can't wait till the day I can wake up right next to you.,0
"Are you sales? Because we will always ABC, always be closing.",0
"Hey babe, what's your PB lineage?",0
Can you say a novena for me? I need God to put someone like you in my life.,0
I had to make my aperture smaller because you are gorgeously bright.,1
"Forget about pumpkin, let's get straight to hump king.",0
We have a connection stronger than our wifi.,1
I don't know how to spell. I thought happiness starts from H. But it really starts from U.,0
"Hey babe, wanna check out my life jacket tan?",1
Roses are red and violets are blue there’s nothing in the world more prettier than you.,0
"My friend told me to come and meet you, he said that you are a really nice person. I think you know Him, Jesus, yeah, that's his name.",0
I put the stud in Bible study.,0
Are you a toaster? Because you're turning me from soft to hard real quick.,1
"Girl are you a sharpener, because you making me hard.",0
"In every turn of the boat, it felt as if I’ve found you somewhere on the pages of my book.",1
I don’t have any pumpkins this year. Wanna be mine?,0
Are you the Dustbin? Because I wanna put all my junk in you!,0
"I lost my cell phone, would you mind calling it real quick?",0
Are you hot or is that just the holy spirt burning inside you?,0
"Nice dock, mind if I park my boat in it?",0
Would you like to sip on a margarita laying on a boat watching a sunset on a calm night?,0
"Girl, my lust for you is greater than my thirst for enlightenment has to wait...",1
Did it hurt? When you fell out of heaven?,0
Ever partied at a skeleton show?,0
"I've been reading Joshua, but how many times do I have to walk around you before you fall for me?",0
Are you a bowman? Because I’d love to see you blow the guy.,1
Let me show you there is a God.,0
Do you have a microwave oven? Because you melt my heart.,0
"It goes against my belief to be judgmental, but your beauty outshines everyone in the room.",1
"Hey, wanna watch p*rn in my mirror?",0
Soon enough babe I will put a rock on your finger.,0
I left most of my gear at home but I did bring my 200mm.,0
"Babe, are you ready to take my pumpkin?",1
I believe one of my ribs belongs to you.,0
I want to climb your trees and swing.,0
"Babe, I don't need no breakfast in bed when I just want to feast on your beauty.",1
I’m a geologist and I’m hung like a horst.,0
Babe you got any change? Because you are a fine dime piece.,0
You have an amazing smile! Probably because of your tulips.,0
I'd sit in a pumpkin patch with you any night.,0
Are you a firework?! Because you light up my eyes.,1
Is it morning yet? I couldn’t tell if it’s light out or if it’s your beauty lighting the room.,0
Do you have a mechanical pencil? Because I got the lead that will fit just right.,0
Our parents engaged us when we were little... they must have forgotten to tell you.,1
Let's turn off the lights so I can show you some lightning.,0
Are you a sharpener. Because I'd like to stick my pencil in you.,1
I must be in a museum because you truly are a work of art.,0
Hold my stick and we will bang in all different ways and tones.,0
I'd love to show you 50 shades of grace...,0
"You look familiar, because you look just like my next girlfriend!",0
"There are only two mistakes one can make along the road to truth; not going all the way, and not starting.",0
What're you doing for the rest of your afterlife?,0
I am a well planned microwave. Because I got a tactical nuke in my pants.,0
"Girl, you put the motorboat in your boat tank fuel.",1
Have you been to the doctor’s lately? Cause I think you’re lacking some vitamin me.,0
"Hey, girl. When I first saw you, I was like و.",1
"Girl, I need to break my fast. Can I have a date?",0
"Are You A Tug Boat? Because, I want you to tug my large vessel.",0
Are you a mirror? Because whenever I look at you I see someone I like.,0
We fit together like lock and key.,0
Wanna put your anchor in my harbor?,0
Are you the drum major? Cause I can't take my eyes off you.,0
Come Back: No im from alabama,0
What’s that wonderful scent you’re wearing? Oh! That’s just you? I love it.,0
How's your walk with the Lord? Let's share our hearts.,0
"Roses are red, daisies are fine. Come this morning and I’ll make you mine.",0
"Are you a camera? Because every time I see you, I smile.",1
Girl are you my eye glasses? Because I can't see my future without you,0
“Kiss me. Kiss me as if it were the last time.” — Casablanca,0
I’d never play hide and seek with you because someone like you is impossible to find.,0
Are you a present? Because I see you under my tree.,0
Are you related to Jean-Claude Van Damme? Because Jean-Claude Van Damme you’re sexy!,0
"Hey baby, I love how you are like sedimentary rock. I just want to go deeper and deeper into your layers.",0
You must be my angel cause you're the Answers to all my prayers.,1
Guess what the doctor just told me. I need some sunshine so that's why I got you to brighten my day.,0
Nice guns.,0
If you're trash...Is that why I want to take you out so often?,0
"Once you get on my boat, you will never need another vessel.",0
"Babe, you send me good vibes and my sticks so hard to break your drum.",1
Girl are you a toaster? Because I want to insert some fresh toast into you and eat you for breakfast.,0
Are you lost ma'am? Because the celestial kingdom is a long way from here!,1
People ask if it hurt when you fell from heaven...But maybe you just got back from hell. Because you are smoking hot.,0
"I love you like Abelard loved Heloise… but without the fornication, lying, public disgrace or castration.",1
Are you a camera? Because we can take this to my place and see what develops.,0
I didn't know angels could fly so low!,0
There is something wrong with my phone. Could you call it for me to see if it rings?,0
"Was your dad a boxer? Because damn, you’re a knockout!",0
"Alphabet pick up line come back. If i could rearrange the alphabet, i'll put F-T-R-E together and enjoy a future without U.",0
Chicks before pricks.,0
"There must be something wrong with my eyes, I can’t take them off you.",0
Is that a mistletoe above your head or are you about to kiss me?,1
You look familiar comeback: That's because I have rejected you many times already.,0
An angel said he would destroy me if I did not sleep with you.,0
I’m so glad we pricked each other.,0
Do you have a light? Because you are smoking hot.,0
I put the 'pump' in pumpkin pie.,0
Forget about PJ's. I am more into BJ's.,1
I love pumpkin spice a latte.,0
"Do not be on the rocks, be on my bed instead.",0
"I’m thinking about buying a new phone, because this crappy one doesn’t have your number in it.",0
Babe are you a pencil sharpener? Because I want to shove and turn my wood in your hole.,1
Damn girl do you have a mirror in your pocket. Because I can see myself in your pants.,0
Your heart for worship is extremely attractive. The way that you sing your heart out and throw your hands in the air... Gracious.,0
I'll never desert you.,0
Do you have a cell phone? My mom told me to call her when I find the girl of my dreams!,0
"Excuse me, is this pew taken?",1
"There is no god, so no going to hell if we fuck.",0
"Girl, do you have a pencil? So I can draw every inch of you.",0
You look so familiar! I swear I've seen you before. OH that's right! In my piggie bank. Cause you a Dime.,0
"Babe, I am ready to carve out some fun out of you tonight.",0
You’re stuck with me.,1
"Girl, I got the package. It's bigger on the inside.",0
Do you have a cell phone? Because the cell tower in my pants would like to connect with you.,1
I think there's something wrong with my cell phone. It doesn't have your number in it.,0
My skeleton want to party with yours.,0
"You’re so sweet, you’re giving me a toothache.",0
How you bin doing?,0
Error 404: Your phone number seems to be missing from my phone.,1
"Hey girl, reading Leviticus with you was so fun! Let's do that again!",1
Our love will grow just like The Great Deku Tree.,1
"My point is, I want to be with you.",1
Are you a palm tree? Because I really want those dates,0
"If you were a tree, you would be an evergreen. From the first time I saw you; you have been looking this good.",0
Roses are Red and Tulips are Tulips. I can’t get my mind off your two lips.,0
"Excuse me, you dropped something. Your standards. Hi I am just right for you.",0
May you have a morning as beautiful as your eyes!,1
I like the black spot on your forehead.,1
"Girl, are you a pencil? Because I would pen-itrate you any time.",0
"You and me, we're like loaves and fishes. We just might be a miracle together.",0
Are you a pair of socks. Wool will have a great time together.,1
I think there’s something wrong with my phone. Could you try calling it for me to see if it rings?,1
"Thankfully, there is no heaven or hell, because I have some deadly sins in mind.",0
Were you in Boy Scouts? Because you sure have tied my heart in a knot.,0
Hey girl. Don't worry. I'll be sure to sit next to you during the prayer so that we can hold hands.,0
Do you like Revelations? I'm not wearing any underwear.,0
Good night! I shall miss you til morning.,0
You got the harbor. I got the boat. What say we tie up for the night?,0
"Inside you, I shall plant a tree. Metaphorically speaking, of course.",0
"Hey girl, are you a toaster? Because I want to shove French bread into you.",0
"I have been dreaming about you all night, and my morning seeing you is as good as can be.",1
(like the other one) Wanna pray with me? *holds hands* Lets start with a rosary…,0
"You so hot, you turn my dingy into a full sized yacht.",0
I plan to ask a girl out. Here is a picture of her.,0
You got dimes? Because I would like to wrap you in my sheets.,1
"So, my parents are home, you wanna come over?",1
This atheist would love to be in YOUR foxhole…,1
"Let's get some trampolines, because I want to spring into love with you.",0
Did the sun come out or did you just smile at me?,0
Are you an artist? Because you’re really good at drawing me in.,1
"Well, here I am. What are your other two wishes?",0
Are you zero APR laon? Because your term says that you will have higher interest for me soon.,0
"I am a package delivery man, give me your number so I could schedule you for a pick up.",0
"If my wallet look like a bible, it's only because the Word of God is ore valuable to me than gold.",1
"Girl, by the time I am done, your pussy will never want to get off of my tree trunk.",1
"If you are amazed at all my trampoline jumping tricks, just wait and see the tricks I can do in bed.",0
The manager told me to take the trash out. So are we going or what?,0
"Damn girl, are you a mechanical pencil? Because you’re finer than .7mm lead.",0
I think it's cute when we're in the car and you turn down the music when a swear word is coming up.,0
"Hey...let's be like Joseph Smith, and score some ladies by creating our own religion.",0
Can I have a band aid? Because you should patch me up after you stole my heart.,0
Are you looking for a gourd time?,0
I've got something you can catch.,0
Are you a pencil sharpener? Because I wanna put my tip inside you hole.,1
My bed is always open for you. No pajamas required.,0
"Nice pumpkins! And I like your boobs, too.",0
7 plagues is nothing compare to what I'd go through for you.,0
I don't work at the post office... but I'll inspect your package.,0
I really like that shirt on you. But I think it would look better in the morning on my living room floor.,1
"Damn baby, Are you a phone? Because I want to hold you in my hands all day and ignore the rest of the world while I stare at you alone in my bedroom.",0
Dang Girl! I like the way your spikes match your shoes.,1
"I know Paul says that it's better to stay single, but ever since I met you I knew that would be impossible for me.",0
"If I received inspiration my whole life, like I did just now seeing you, I would be so inspired as to be the greatest prophet ever.",0
Would you like to see my collection of bukharts?,0
"Girl, nice delivery. I want to inspect your package before receiving.",0
Do you have a Band-Aid? Because I scraped my knee falling for you.,0
Are you a pastafarian? Because you have just been touched with noodly appendage.,0
Are you a football player? Because I’d like you touchdown there!,0
Stop lighting me up. I'm gonna explode!,0
"So, what would you say to some paschal breakfast tomorrow? (daily mass)",0
If I had a bead for every time I thought of you I would have a joyful mystery.,0
"Roses are red, and very famous. Coffee and movie is old style, lets try some Netflix and Chill.",0
"Yeah, I predicted David over Goliath.38. (circle the person while looking at them) Where are the wings? You are an angel right?",0
My life had been incomplete all this time. You are the missing sock that I have been looking for.,0
"If I were a squirrel, and you were a tree. I’d put my nuts in you.",0
It’s the motion of the ocean not the size of the wave.,1
"Roses are red, violets are blue, it would be a shame if I couldn't date you!",0
How would you like to join my Purpose Driven Life?,0
I'd fast for a lifetime just to have one iftar with you.,0
The Gianna to my Pietro?,0
"How do you like your eggs in the morning? Scrambled, over-easy, or fertilized?",0
Are you a adjustable loan? Because I sense my interest rising.,0
We can be one with everything starting with you and me becoming one.,1
Guess what I am wearing tonight. I guess nothing if you come over.,0
"Babe, I would be your morning alarm.",1
"Are you a Crayon? Because, I am a pencil and I draw my world but i need you to color it.",0
If I had I a vocation to the priesthood and I met you… I'd still go to the seminary.,1
"Girl, would you grant my wish tonight? I have just made my wishes upon your starry eyes.",0
"Girl, you are not the girl to drop your standards. And that is why I am the only guy here for you tonight.",1
"Hey girl, are a sock? Because I want to wear you and we can go places.",0
Bone up.,0
"I know I'm a Buddhist, but GOD DAMN you're gorgeous!",0
Hey are you a toaster? Because a bath with you would send me straight to Heaven.,0
I would like to study the theology of your body.,0
King Solomon may have been wise…but I'm more of a one-wife guy myself.,0
"Kiss me if I’m wrong, but isn’t your name Richard?",0
"Naturally, I'd select you over anyone else.",0
Needles to say you are mine.,0
The Holy Spirit compels me. I can't help but draw near to you.,0
Roses are red. Violets are blue. You're so halal. Can I nikkah you?,0
"We are not socks, but I can still cum in you and rub all over your feet.",0
"Hey, is it just me or are we destined to be married?",0
I can show you how to row the boat.,1
"You look familiar comeback: So, you have seen me stalking you.",0
Did you have lucky charms for breakfast? Because you're looking magically delicious.,0
You got socks? Because you are my sole mate.,0
How many times do I have to walk around you to make you fall for me?,0
You look familiar comeback: Like your dead girlfriend?,0
Hey wanna see my seer stones?,0
You can climb my mast anytime!,0
"I didn’t trip over my thobe, I fell for you.",1
"Hey baby, I'll have you cummingtonite if you stick your dickite into my borehole.",0
"If you want to please me, just get on a boat.",0
I am the missing sock that you have been looking for. Now we could explore the world together.,0
Meeting you is like how I feel when I first bought my house key!,0
Do you like role playing? Because I want to hit on you until your loot drops.,0
Do you bounce in bed as good as you jump on these trampolines?,0
Are you a traditionalist? Because your form is extraordinary.,0
Think of me as the Anti-Jesus. You won't be able to walk after I've finished with you.,0
Are you a skeleton? Because I wanna bone you.,0
"Hey baby, there is no need for condoms. I don't believe in STDs.",1
"(At mass) Same time, same place next Sunday?",0
It must be Laylatul Qadr. Because that's the night that angels come down from Heaven.,0
"I'm no Joseph, but I'm having trouble interpreting the dreams I've been having about you.",1
Alphabet pick up line comeback. I would put B Y E together.,0
Do you know how I can volunteer with the Sunday School? I really love kids.,1
I thought I knew every alphabet letters. But tonight. I realized that I never knew U.,1
"Babe, here's my number. I could deliver my package to your bed any night.",0
If I had a dime every time I saw a girl as pretty as you I would only have ten cents. Because no one is as pretty as you.,0
"Roses are red, Violets are blue, You can be my Cinderella, I'll even give you a shoe.",0
"Hey baby, take off those shoes and skirt and get comfortable.",0
"If you were a cactus, I’d prick you!",1
Roses aren't the only thing that will prick you tonight.,1
"Babe, you are a skeleton to me. Because I love every bone in your body.",0
We make a prickly pair.,0
Roses are red violets are blue I can’t rhyme but can I date you?,1
Hey girl. Bathsheba had nothing on you.,0
"There must be a light switch on my forehead because every time I see you, you turn me on!",0
I know every letter in the alphabet. And I just wish that I know u better.,0
Do you like drum and bass? Cause you got me wanting 174 bangs per minutes.,0
Are you a locksmith? Because you've got the key to my heart.,0
"Is that a Wi-Fi enabled device in your pocket, or are you just glad to see me?",0
"“I guess when you’re young, you just believe there’ll be many people… you’ll connect with. Later in life, you realize it only happens a few times.” — Before Sunset",1
What say we go into a dark room and see what develops after our date?,0
Is your cat stuck in a tree? Because I’m here to save that pussy.,0
"My favorite commandment is the one about ""loving one another.""",0
Are you a toaster? Because my mind's toasted about you.,1
"Baby, somebody better call God, cause he's missing an angel!",0
Alphabet pick up line come back. ABCDenied.,0
"If I had a garden, I'd put your tulips next to my tulips.",0
Is that a mirror in your pocket because I see myself in your pants.,0
How can I plan our wedding without your number?,0
Are you a bonehead? Because I want to put my boner into your head.,0
What's a nice girl like you doing in a confession line like this?,0
I'm pretty much considered an elder in the congregation these days.,0
Did it hurt when you fell from heaven? Because I am your perfect down to earth type of guy.,0
"Your credit score is so fine, you can borrow my d*ck any time.",0
The Crystalina to my Jason?,0
Did your license get suspended for driving all these girls crazy?,0
"If I got a dollar for every time I saw an angel, you would have to pull out your wallet.",0
"Are those real boobs, or are you wearing Nephi's breast plate?",0
You’re so beautiful that you made me forget my pickup line.,0
"All the alphabets of ABCs suit you, girl. You are amazing from A, brilliant from B, and cute from C, and I will give you a D because you deserve it.",1
"Roses are red, pickles are green, I like your legs and what’s in between!",0
"The tree of life just called, it wants your sweetness behind.",1
I hope your morning is as bright as your smile.,0
"Hey, I just met you, and this is crazy, but here's a ring, let's get married maybe?",0
Are you my morning coffee? Because you fill me with energy.,0
Does your face hurt? Because your smile is forever engrained in my mind.,0
"Girl, are you shoelaces? Because damn you are tight.",0
Like a good banging? Because I’m the best drummer around.,0
I just woke up and you’re already on my mind.,0
Do you work for UPS? Because you’ve been staring at my package all night.,0
"I may not be a genie, but I can make your dreams come true.",0
"I can sing my ABC's to you, until you sing omg back to me.",0
“I knew you before I met you. I’ve known you my whole life.” — Nayyirah Waheed,0
Want to practice some REAL gun control?,0
"Babe, I cook the best alphabet soup. Because you gonna be choking on my D.",0
Your tulips bloom for me.,0
His Iman is like his beard. It's full and perfect.,1
"Roses are red. Sunflowers are yellow. I’m good in bed, will you be my bedfellow?",0
"Babe, I can work your corner.",0
"I just want to c_ddle, but I can't because I am missing U.",0
"If I was a tree in a forest, would you hear me falling for you?",0
Can I plant my tree in your rain forest?,0
My score may not be that good but my phone number sure is!,0
Are you Netflix? Because I could watch you for hours.,0
Is that a copy of Origin of Species in your pocket or are you just happy to see me?,0
Girl are you ready to get naughty? Because did it hurt when you fell from the heavens?,0
"Babe, you inspire me to my former glory every morning.",0
"Girl, can I put some boat fuel into your tank?",0
"What's a smart, attractive person like myself doing without your mobile number?",1
"Nice boat, wanna come aboard?",0
"I’m sorry, were you talking to me? Well then, please start.",0
For you I would slay two Goliaths!,0
"Apples, Peaches, Pumpkin Pie. Soon Your Love Will Be All Mine.",0
"Many are the women of proven worth, but you have surpassed them all…",0
Is this pew taken?,0
"I feel like eating out this morning, want to come to my place?",0
"I may not go to church, but I have an organ for you.",0
"I have a bible verse tattoo, it's permanent, it's also in Latin.",0
Do you have a skeleton? Because I want to feed you my bone meal.,0
"Girl, I will prickle your fancy.",0
"Kiss me if I’m wrong, but dinosaurs still exist, right?",0
"This boat is like me, I could save you in your stormy days and darkest nights.",0
Do you garden? I will go down on your tulips.,0
Wanna hold the priesthood? (Guy holds his arms out),0
So… do you come here often?” (in mass),0
Scared you'll get hurt like you did last time? I will never hurt you.,0
You know what the temple veil and I have in common? We're both ripped.,0
"You are like a pumpkin, you're hard on the outside and soft on the inside.",0
"Why do you look so familiar, have we met before?",0
“You don’t know how hard it is being a woman looking the way I do.” — Who Framed Roger Rabbit,1
"Girl you look familiar, because I see you in my future.",0
"I know you've already said no once, but call me Joshua because I'm going to break down your walls.",0
Are you a thief? Because you stole all the stars from the sky and put them in your eyes.,0
Are you a rock? Because I want to climb you like one.,0
"Girl, asking you out is like taking off band aid. Should I peel off slowly, or rip off quickly?",1
Babe are you a pumpkin baby? Because daddy jack is here to make you mine.,0
You don't like the culture of death either? Wow! We have so much in common!,0
Unfortunately I can't perform miracles and I've only got enough bread and fish for 2 people.,0
Are you Rubix cube? Because I want to fondle & cube you all night long.,0
Can you give me your number so I can PHONE you?,0
I believe you have one of my ribs…,0
"If you texted me every time I thought of you, you'd be blowing up my phone.",0
"Girl, you a Rubik's cube? Because I want to lube you in so many layers.",0
If you flash me with your camera then I’ll flash you.,0
Hey baby you’re like the North Star. The head of my Big Dipper pointing right at you.,0
"For some reason, I was feeling a little off today. But when you came along, you definitely turned me on.",0
